{
  "version": "1.0",
  "runId": "2026-03-05T23-23-15-182Z",
  "stageId": "core",
  "stageLabel": "E2E core lane",
  "lane": "core",
  "provider": "none",
  "mode": "sequential",
  "failurePolicy": "continue-on-error",
  "status": "pass",
  "command": [
    "pnpm",
    "test:core:all"
  ],
  "startedAt": "2026-03-05T23:23:17.554Z",
  "finishedAt": "2026-03-05T23:25:58.271Z",
  "durationMs": 160717,
  "exitCode": 0,
  "ports": {
    "postgres": 5542,
    "platformApi": 8142,
    "dashboard": 3142
  },
  "composeProjectName": "agentbaton-batch-2026-03-05t23-23-15-182z-core",
  "logs": {
    "stdout": "/root/.openclaw/agents/engineer/workspace/projects/agentbaton-platform/tests/artifacts/batch/s5.5-google-20260305T232314Z/stages/core/stdout.log",
    "stderr": "/root/.openclaw/agents/engineer/workspace/projects/agentbaton-platform/tests/artifacts/batch/s5.5-google-20260305T232314Z/stages/core/stderr.log"
  },
  "artifacts": {
    "laneArtifactsRoot": "/root/.openclaw/agents/engineer/workspace/projects/agentbaton-platform/tests/artifacts/batch/s5.5-google-20260305T232314Z/lanes/core/artifacts",
    "laneResultsPath": "/root/.openclaw/agents/engineer/workspace/projects/agentbaton-platform/tests/artifacts/batch/s5.5-google-20260305T232314Z/lanes/core/results.v1.json"
  },
  "errorExcerpt": ""
}
