{
  "version": "1.0",
  "runId": "2026-03-05T23-23-15-182Z",
  "stageId": "integration-dashboard",
  "stageLabel": "E2E integration/dashboard lane",
  "lane": "integration",
  "provider": "none",
  "mode": "sequential",
  "failurePolicy": "continue-on-error",
  "status": "pass",
  "command": [
    "pnpm",
    "exec",
    "tsx",
    "tests/live/harness/runner.ts",
    "--dashboard"
  ],
  "startedAt": "2026-03-05T23:25:58.271Z",
  "finishedAt": "2026-03-05T23:27:23.805Z",
  "durationMs": 85534,
  "exitCode": 0,
  "ports": {
    "postgres": 5542,
    "platformApi": 8142,
    "dashboard": 3142
  },
  "composeProjectName": "agentbaton-batch-2026-03-05t23-23-15-182z-integration-dashboard",
  "logs": {
    "stdout": "/root/.openclaw/agents/engineer/workspace/projects/agentbaton-platform/tests/artifacts/batch/s5.5-google-20260305T232314Z/stages/integration-dashboard/stdout.log",
    "stderr": "/root/.openclaw/agents/engineer/workspace/projects/agentbaton-platform/tests/artifacts/batch/s5.5-google-20260305T232314Z/stages/integration-dashboard/stderr.log"
  },
  "artifacts": {
    "laneArtifactsRoot": "/root/.openclaw/agents/engineer/workspace/projects/agentbaton-platform/tests/artifacts/batch/s5.5-google-20260305T232314Z/lanes/integration-dashboard/artifacts",
    "laneResultsPath": "/root/.openclaw/agents/engineer/workspace/projects/agentbaton-platform/tests/artifacts/batch/s5.5-google-20260305T232314Z/lanes/integration-dashboard/results.v1.json"
  },
  "errorExcerpt": ""
}
